{
  "$schema": "../schemas/alphabet-data.schema.json",
  "alphabet": "s",
  "pronunciation": {
    "ipa": "/ɛs/",
    "spelling": "ESS"
  },
  "details": "“S” is the nineteenth letter of the modern English alphabet. It represents the /s/ sound, as in 'sun'. The letter 'S' is often found in words related to shapes, sizes, and speed.",
  "regionalMappings": {
    "Bengali": "/assets/vectors/letters/bengali/s.png",
    "Hindi": "/assets/vectors/letters/hindi/s.png"
  },
  "wordsData": [
    {
      "word": "Sun",
      "definition": "the star around which the Earth orbits, providing light and warmth",
      "example": "The sun is shining brightly today.",
      "image": "/assets/images/sun.png"
    },
    {
      "word": "Star",
      "definition": "a luminous point in the night sky, visible from Earth",
      "example": "We saw many stars while camping.",
      "image": "/assets/images/star.png"
    },
    {
      "word": "Snake",
      "definition": "a long, legless reptile",
      "example": "The snake slithered through the grass.",
      "image": "/assets/images/snake.png"
    },
    {
      "word": "Ship",
      "definition": "a large boat used for traveling on water",
      "example": "The ship sailed across the ocean.",
      "image": "/assets/images/ship.png"
    }
  ],
  "rhymes": [
    {
      "name": "S is for Sun (to the tune of 'Twinkle, Twinkle, Little Star')",
      "content": [
        "S is for sun, so warm and bright,",
        "Shining down with golden light.",
        "Lighting up the sky so blue,",
        "S is for sun, we love you!"
      ]
    },
    {
      "name": "S is for Snake (to the tune of 'If You’re Happy and You Know It')",
      "content": [
        "S is for snake, it slithers by,",
        "Moving quickly, never shy.",
        "With its scales and winding tail,",
        "S is for snake, in the grass it’ll sail!"
      ]
    }
  ]
}
