{
  "$schema": "../schemas/alphabet-data.schema.json",
  "alphabet": "h",
  "pronunciation": {
    "ipa": "/eɪtʃ/",
    "spelling": "AYCH"
  },
  "details": "“H” is the eighth letter of the modern English alphabet. It represents the voiceless glottal fricative /h/ as in 'hat'. In some dialects, it may be silent at the beginning of words. It originated from the Semitic letter 'ḥet'.",
  "regionalMappings": {
    "Bengali": "/assets/vectors/letters/bengali/h.png",
    "Hindi": "/assets/vectors/letters/hindi/h.png"
  },
  "wordsData": [
    {
      "word": "Hat",
      "definition": "a shaped covering for the head worn for warmth, fashion, or protection",
      "example": "He wore a big red hat on his head.",
      "image": "/assets/images/hat.png"
    },
    {
      "word": "House",
      "definition": "a building for human habitation",
      "example": "They live in a big house with a garden.",
      "image": "/assets/images/house.png"
    },
    {
      "word": "Hen",
      "definition": "a female chicken, especially one that lays eggs",
      "example": "The hen laid three eggs today.",
      "image": "/assets/images/hen.png"
    },
    {
      "word": "Horse",
      "definition": "a large plant-eating domesticated mammal with solid hooves",
      "example": "The horse galloped across the field.",
      "image": "/assets/images/horse.png"
    }
  ],
  "rhymes": [
    {
      "name": "H is for Hen (to the tune of 'Mary Had a Little Lamb')",
      "content": [
        "Hen is walking in the yard, in the yard, in the yard.",
        "Hen is walking in the yard, clucking all the way!"
      ]
    },
    {
      "name": "H is for House (to the tune of 'The Wheels on the Bus')",
      "content": [
        "The roof of the house goes up and down,",
        "Up and down, up and down,",
        "The roof of the house goes up and down,",
        "All through the town!"
      ]
    }
  ]
}
