{
  "$schema": "../schemas/alphabet-data.schema.json",
  "alphabet": "v",
  "pronunciation": {
    "ipa": "/vi/",
    "spelling": "VEE"
  },
  "details": "“V” is the twenty-second letter of the modern English alphabet. It represents the /v/ sound, as in 'van'. The letter 'V' is often used in words related to victory, values, and vision.",
  "regionalMappings": {
    "Bengali": "/assets/vectors/letters/bengali/v.png",
    "Hindi": "/assets/vectors/letters/hindi/v.png"
  },
  "wordsData": [
    {
      "word": "Van",
      "definition": "a large vehicle used for transporting goods or people",
      "example": "The van was filled with boxes for the move.",
      "image": "/assets/images/van.png"
    },
    {
      "word": "Vase",
      "definition": "a container used to hold flowers or decorative items",
      "example": "She placed the flowers in a beautiful vase.",
      "image": "/assets/images/vase.png"
    },
    {
      "word": "Violin",
      "definition": "a string instrument played with a bow",
      "example": "He played a beautiful melody on the violin.",
      "image": "/assets/images/violin.png"
    },
    {
      "word": "Vulture",
      "definition": "a large bird of prey that feeds on carrion",
      "example": "The vulture circled above the carcass.",
      "image": "/assets/images/vulture.png"
    }
  ],
  "rhymes": [
    {
      "name": "V is for Van (to the tune of 'Twinkle, Twinkle, Little Star')",
      "content": [
        "V is for van, big and wide,",
        "Moving along, with wheels that glide.",
        "Carrying goods or people too,",
        "V is for van, it’s always in view!"
      ]
    },
    {
      "name": "V is for Violin (to the tune of 'If You’re Happy and You Know It')",
      "content": [
        "V is for violin, sweet and clear,",
        "The music we hear, brings us cheer.",
        "With strings so fine and bow in hand,",
        "V is for violin, across the land!"
      ]
    }
  ]
}
