{
  "$schema": "../schemas/alphabet-data.schema.json",
  "alphabet": "m",
  "pronunciation": {
    "ipa": "/ɛm/",
    "spelling": "EM"
  },
  "details": "“M” is the thirteenth letter of the modern English alphabet. It represents the /m/ sound, as in 'moon'. The letter 'M' is commonly used in words associated with motion, music, and the natural world.",
  "regionalMappings": {
    "Bengali": "/assets/vectors/letters/bengali/m.png",
    "Hindi": "/assets/vectors/letters/hindi/m.png"
  },
  "wordsData": [
    {
      "word": "Moon",
      "definition": "the natural satellite of the Earth, visible by reflection of sunlight",
      "example": "The moon shone brightly in the night sky.",
      "image": "/assets/images/moon.png"
    },
    {
      "word": "Monkey",
      "definition": "a small to medium-sized primate, typically with a long tail",
      "example": "The monkey swung from tree to tree.",
      "image": "/assets/images/monkey.png"
    },
    {
      "word": "Mountain",
      "definition": "a large natural elevation of the earth's surface, typically with a peak",
      "example": "They hiked up the mountain to see the view.",
      "image": "/assets/images/mountain.png"
    },
    {
      "word": "Mango",
      "definition": "a tropical stone fruit with sweet, juicy flesh",
      "example": "She ate a juicy mango on a hot day.",
      "image": "/assets/images/mango.png"
    }
  ],
  "rhymes": [
    {
      "name": "M is for Moon (to the tune of 'Twinkle, Twinkle, Little Star')",
      "content": [
        "M is for moon, so big and bright,",
        "Shining down through the quiet night.",
        "Up in the sky so high and wide,",
        "M is for moon, a glowing guide!"
      ]
    },
    {
      "name": "M is for Monkey (to the tune of 'If You’re Happy and You Know It')",
      "content": [
        "Monkey swings from tree to tree,",
        "Swinging, swinging wild and free.",
        "Monkey jumps and monkeys plays,",
        "In the jungle all the day!"
      ]
    }
  ]
}
