{
  "$schema": "../schemas/alphabet-data.schema.json",
  "alphabet": "q",
  "pronunciation": {
    "ipa": "/kju/",
    "spelling": "KWEE"
  },
  "details": "“Q” is the seventeenth letter of the modern English alphabet. It represents the /kw/ sound, as in 'queen'. The letter 'Q' is commonly used in words related to questions, qualities, and quickness.",
  "regionalMappings": {
    "Bengali": "/assets/vectors/letters/bengali/q.png",
    "Hindi": "/assets/vectors/letters/hindi/q.png"
  },
  "wordsData": [
    {
      "word": "Queen",
      "definition": "a female ruler of a country or a female member of a royal family",
      "example": "The queen ruled the kingdom with kindness.",
      "image": "/assets/images/queen.png"
    },
    {
      "word": "Question",
      "definition": "a sentence or phrase used to ask for information or clarification",
      "example": "She asked a difficult question during the lesson.",
      "image": "/assets/images/question.png"
    },
    {
      "word": "Quilt",
      "definition": "a bed covering made of layers of fabric, typically sewn together",
      "example": "The quilt kept her warm on cold nights.",
      "image": "/assets/images/quilt.png"
    },
    {
      "word": "Quick",
      "definition": "moving fast or doing something in a short amount of time",
      "example": "She gave a quick answer to the question.",
      "image": "/assets/images/quick.png"
    }
  ],
  "rhymes": [
    {
      "name": "Q is for Queen (to the tune of 'Twinkle, Twinkle, Little Star')",
      "content": [
        "Q is for queen, so kind and fair,",
        "With a crown and jewels in her hair.",
        "Ruling the kingdom with a gentle hand,",
        "Q is for queen, the ruler of the land."
      ]
    },
    {
      "name": "Q is for Question (to the tune of 'If You’re Happy and You Know It')",
      "content": [
        "Q is for question, ask it loud,",
        "Raise your hand and speak it proud.",
        "Getting answers, we will find,",
        "Q is for question, clear your mind."
      ]
    }
  ]
}
