{
  "$schema": "../schemas/alphabet-data.schema.json",
  "alphabet": "t",
  "pronunciation": {
    "ipa": "/ti/",
    "spelling": "TEE"
  },
  "details": "“T” is the twentieth letter of the modern English alphabet. It represents the /t/ sound, as in 'tree'. The letter 'T' is commonly found in words related to time, things, and thinking.",
  "regionalMappings": {
    "Bengali": "/assets/vectors/letters/bengali/t.png",
    "Hindi": "/assets/vectors/letters/hindi/t.png"
  },
  "wordsData": [
    {
      "word": "Tree",
      "definition": "a tall plant with a single stem, branches, and leaves",
      "example": "The tree provides shade on a hot day.",
      "image": "/assets/images/tree.png"
    },
    {
      "word": "Tiger",
      "definition": "a large wild cat with orange fur and black stripes",
      "example": "The tiger prowled silently in the jungle.",
      "image": "/assets/images/tiger.png"
    },
    {
      "word": "Train",
      "definition": "a set of connected vehicles that travel along a track",
      "example": "We took the train to the city.",
      "image": "/assets/images/train.png"
    },
    {
      "word": "Table",
      "definition": "a piece of furniture with a flat surface and typically supported by four legs",
      "example": "She placed the book on the table.",
      "image": "/assets/images/table.png"
    }
  ],
  "rhymes": [
    {
      "name": "T is for Tiger (to the tune of 'Twinkle, Twinkle, Little Star')",
      "content": [
        "T is for tiger, strong and fierce,",
        "Roaming the jungle, where it peers.",
        "With its stripes and mighty roar,",
        "T is for tiger, who wants more?"
      ]
    },
    {
      "name": "T is for Tree (to the tune of 'If You’re Happy and You Know It')",
      "content": [
        "T is for tree, standing tall,",
        "Reaching up, big and small.",
        "With leaves that rustle in the breeze,",
        "T is for tree, it’s full of ease!"
      ]
    }
  ]
}
